{
  "managedBy": "trancendos-governance-v1",
  "schemaVersion": "1.0.0",
  "reviewCadenceDays": 90,
  "services": [
    {
      "name": "npm-registry",
      "provider": "npmjs",
      "category": "package-registry",
      "criticality": "high",
      "documents": {
        "eulaUrl": "https://docs.npmjs.com/policies/terms",
        "tosUrl": "https://docs.npmjs.com/policies/terms",
        "aupUrl": "https://docs.npmjs.com/policies/acceptable-use",
        "privacyUrl": "https://docs.npmjs.com/policies/privacy",
        "dpaUrl": "https://docs.npmjs.com/policies/privacy",
        "factUrl": "https://docs.npmjs.com/about-access-tokens",
        "fastUrl": "https://docs.npmjs.com/about-2fa",
        "slaUrl": "https://www.githubstatus.com/"
      },
      "complianceReview": {
        "lastReviewedUtc": "2026-02-22T00:00:00Z",
        "approvedBy": [
          "platform-governance"
        ],
        "status": "approved"
      },
      "resilience": {
        "hasNoSingleDependencyRisk": true,
        "alternativeProviders": [
          "GitHub Packages",
          "self-hosted registry mirror"
        ],
        "switchPlanSummary": "Maintain mirror strategy and migration runbook for package publish/resolve cutover.",
        "maxDowntimeMinutes": 30
      }
    },
    {
      "name": "github-actions",
      "provider": "GitHub",
      "category": "ci-cd",
      "criticality": "high",
      "documents": {
        "eulaUrl": "https://docs.github.com/en/site-policy/github-terms/github-terms-of-service",
        "tosUrl": "https://docs.github.com/en/site-policy/github-terms/github-terms-of-service",
        "aupUrl": "https://docs.github.com/en/site-policy/acceptable-use-policies/github-acceptable-use-policies",
        "privacyUrl": "https://docs.github.com/en/site-policy/privacy-policies/github-privacy-statement",
        "dpaUrl": "https://docs.github.com/en/site-policy/privacy-policies/github-general-privacy-statement",
        "factUrl": "https://docs.github.com/en/actions/security-guides/security-hardening-for-github-actions",
        "fastUrl": "https://docs.github.com/en/authentication/keeping-your-account-and-data-secure/about-authentication-to-github",
        "slaUrl": "https://www.githubstatus.com/"
      },
      "complianceReview": {
        "lastReviewedUtc": "2026-02-22T00:00:00Z",
        "approvedBy": [
          "platform-governance"
        ],
        "status": "approved"
      },
      "resilience": {
        "hasNoSingleDependencyRisk": true,
        "alternativeProviders": [
          "self-hosted CI runners",
          "secondary CI provider"
        ],
        "switchPlanSummary": "Keep CI pipeline as code portable and maintain fallback execution paths.",
        "maxDowntimeMinutes": 60
      }
    }
  ]
}
